	{
	  "$schema": "http://json-schema.org/draft-07/schema#",
	  "type": "object",
	  "properties": {
	    "message": { "type": "string" },
	    "error_type": { "type": ["string", "null"] },
	    "errors": {
	      "type": ["object", "null"],
	      "additionalProperties": true
	    },
	    "listing": {
	      "type": ["object", "null"],
	      "properties": {
	        "id": { "type": "integer" },
	        "make": { "type": "string" },
	        "model": { "type": "string" },
	        "finish": { "type": "string" },
	        "year": { "type": "string" },
	        "title": { "type": "string" },
	        "created_at": { "type": "string", "format": "date-time" },
	        "shop_name": { "type": "string" },
	        "description": { "type": "string" },
	        "condition": {
	          "type": "object",
	          "properties": {
	            "uuid": { "type": "string", "format": "uuid" },
	            "display_name": { "type": "string" },
	            "description": { "type": "string" }
	          }
	        },
	        "price": {
	          "type": "object",
	          "properties": {
	            "amount": { "type": "string" },
	            "amount_cents": { "type": "integer" },
	            "currency": { "type": "string" },
	            "symbol": { "type": "string" },
	            "display": { "type": "string" }
	          }
	        },
	        "inventory": { "type": "integer" },
	        "has_inventory": { "type": "boolean" },
	        "offers_enabled": { "type": "boolean" },
	        "auction": { "type": "boolean" },
	        "categories": { "type": "array", "items": { "type": "string" } },
	        "listing_currency": { "type": "string" },
	        "buyer_price": {
	          "$ref": "#/properties/listing/properties/price"
	        },
	        "seller_price": {
	          "$ref": "#/properties/listing/properties/price"
	        },
	        "state": {
	          "type": "object",
	          "properties": {
	            "slug": { "type": "string" },
	            "description": { "type": "string" }
	          }
	        },
	        "wanted": { "type": "boolean" },
	        "accepted_payment_methods": { "type": "array", "items": { "type": "string" } },
	        "location": {
	          "type": "object",
	          "properties": {
	            "display_location": { "type": ["string", "null"] }
	          }
	        },
	        "draft": { "type": "boolean" },
	        "live": { "type": "boolean" },
	        "local_pickup_only": { "type": "boolean" },
	        "cloudinary_photos": { "type": "array", "items": { "type": "string" } },
	        "shop": {
	          "type": "object",
	          "properties": {
	            "feedback_count": { "type": "integer" },
	            "preferred_seller": { "type": "boolean" },
	            "rating_percentage": { "type": "number" }
	          }
	        },
	        "stats": {
	          "type": "object",
	          "properties": {
	            "views": { "type": "integer" },
	            "watches": { "type": "integer" }
	          }
	        },
	        "offer_count": { "type": "integer" },
	        "shipping_policy": { "type": "string" },
	        "payment_policy": { "type": "string" },
	        "sold_as_is": { "type": "boolean" },
	        "same_day_shipping_ineligible": { "type": "boolean" },
	        "return_policy": { "type": "object" },
	        "videos": { "type": "array", "items": { "type": "string" } },
	        "is_my_listing": { "type": "boolean" },
	        "photos": { "type": "array", "items": { "type": "string" } },
	        "shipping": {
	          "type": "object",
	          "properties": {
	            "local": { "type": "boolean" },
	            "rates": { "type": "array", "items": { "type": "object" } },
	            "initial_offer_rate": {
	              "type": "object",
	              "properties": {
	                "region_code": { "type": ["string", "null"] },
	                "rate": {
	                  "type": "object",
	                  "properties": {
	                    "original": { "$ref": "#/properties/listing/properties/price" },
	                    "display": { "$ref": "#/properties/listing/properties/price" }
	                  }
	                },
	                "carrier_calculated": { "type": "boolean" },
	                "regional": { "type": "boolean" },
	                "destination_postal_code_needed": { "type": "boolean" }
	              }
	            },
	            "free_expedited_shipping": { "type": "boolean" }
	          }
	        },
	        "seller": {
	          "type": "object",
	          "properties": {
	            "paypal_email": { "type": ["string", "null"] }
	          }
	        },
	        "_links": {
	          "type": "object",
	          "properties": {
	            "photo": { "type": "object", "properties": { "href": { "type": "string" } } },
	            "self": { "type": "object", "properties": { "href": { "type": "string" } } },
	            "update": { "type": "object", "properties": { "method": { "type": "string" }, "href": { "type": "string" } } },
	            "end": { "type": "object", "properties": { "method": { "type": "string" }, "href": { "type": "string" } } },
	            "want": { "type": "object", "properties": { "method": { "type": "string" }, "href": { "type": "string" } } },
	            "unwant": { "type": "object", "properties": { "method": { "type": "string" }, "href": { "type": "string" } } },
	            "edit": { "type": "object", "properties": { "href": { "type": "string" } } },
	            "web": { "type": "object", "properties": { "href": { "type": "string" } } }
	          }
	        }
	      }
	    },
	    "warnings": { "type": ["array", "null"], "items": { "type": "string" } }
	  },
	  "required": ["message"]
	}
